{"assets":[{"media_type":"audio/wav","path":"audio/original.wav","role":"original","sha256":"125f39eda3fea4265c129447c18ea5a89ed7302255c7a33ef104393c1f716873","size":52}],"extensions":{"https://example.org/optional":{"𝄞":"supplementary","":"BMP"}},"format":"org.aural.audio-evidence","original":"audio/original.wav","recorded_at":"2026-10-13T18:00:00Z","title":"Café 𝄞","version":"0.2-draft"}